{
  "$schema": "http://json-schema.org/draft-07/schema#",
  "title": "Cyber Risk Pulse compact vulnerability record",
  "type": "object",
  "required": ["id", "tier", "reasons"],
  "properties": {
    "id": { "type": "string", "pattern": "^CVE-[0-9]{4}-[0-9]{4,}$" },
    "desc": { "type": "string" },
    "published": { "type": ["string", "null"] },
    "modified": { "type": ["string", "null"] },
    "status": { "type": ["string", "null"] },
    "vendors": { "type": "array", "items": { "type": "string" } },
    "vendorsRaw": { "type": "array", "items": { "type": "string" } },
    "products": { "type": "array", "items": { "type": "string" } },
    "cwes": { "type": "array", "items": { "type": "string" } },
    "cvss": {
      "type": ["object", "null"],
      "properties": {
        "version": { "type": "string" },
        "score": { "type": ["number", "null"], "minimum": 0, "maximum": 10 },
        "severity": { "type": ["string", "null"] },
        "vector": { "type": ["string", "null"] },
        "source": { "type": ["string", "null"] }
      }
    },
    "epss": {
      "type": ["object", "null"],
      "properties": {
        "p": { "type": ["number", "null"], "minimum": 0, "maximum": 1 },
        "pct": { "type": ["number", "null"], "minimum": 0, "maximum": 1 },
        "date": { "type": ["string", "null"] }
      }
    },
    "kev": {
      "type": ["object", "null"],
      "properties": {
        "isKev": { "type": "boolean" },
        "vendorProject": { "type": ["string", "null"] },
        "product": { "type": ["string", "null"] },
        "name": { "type": ["string", "null"] },
        "dateAdded": { "type": ["string", "null"] },
        "dueDate": { "type": ["string", "null"] },
        "requiredAction": { "type": ["string", "null"] },
        "ransomware": { "type": ["string", "null"] }
      }
    },
    "tier": { "type": "string", "enum": ["P1", "P2", "P3", "P4"] },
    "reasons": { "type": "array", "items": { "type": "string" } },
    "refs": { "type": "array", "items": { "type": "object" } },
    "flags": { "type": "array", "items": { "type": "string" } }
  }
}
