[{"id":"CVE-2026-10001","desc":"A use-after-free in the Windows Server print subsystem allows remote code execution when a crafted job is processed.","published":"2026-07-05T14:00:00Z","modified":"2026-07-19T09:12:00Z","status":"Analyzed","vendors":["Microsoft"],"vendorsRaw":["microsoft"],"products":["windows_server"],"cwes":["CWE-416"],"cvss":{"version":"3.1","score":9.8,"severity":"CRITICAL","vector":"CVSS:3.1/AV:N/AC:L/PR:N/UI:N/S:U/C:H/I:H/A:H","source":"nvd@nist.gov"},"epss":{"p":0.9421,"pct":0.9985,"date":"2026-07-23"},"kev":{"isKev":true,"vendorProject":"Microsoft","product":"Windows Server","name":"Windows Server Print RCE","dateAdded":"2026-07-18","dueDate":"2026-08-08","requiredAction":"Apply vendor updates per instructions.","ransomware":"Known"},"tier":"P1","reasons":["Listed in CISA KEV (known exploited)","Known ransomware campaign use","CVSS 9.8 CRITICAL (v3.1)","EPSS 94.2% probability","EPSS 99.9 percentile","Published recently (17d ago)"],"refs":[{"url":"https://nvd.nist.gov/vuln/detail/CVE-2026-10001","source":"nvd@nist.gov"},{"url":"https://vendor.example/advisory/CVE-2026-10001","source":"vendor"}],"flags":[]},{"id":"CVE-2026-10002","desc":"An out-of-bounds write in the FortiOS SSL-VPN portal permits authenticated code execution.","published":"2026-06-28T11:00:00Z","modified":"2026-07-15T16:40:00Z","status":"Analyzed","vendors":["Fortinet"],"vendorsRaw":["fortinet"],"products":["fortios"],"cwes":["CWE-787"],"cvss":{"version":"3.1","score":8.8,"severity":"HIGH","vector":"CVSS:3.1/AV:N/AC:L/PR:L/UI:N/S:U/C:H/I:H/A:H","source":"nvd@nist.gov"},"epss":{"p":0.621,"pct":0.9702,"date":"2026-07-23"},"kev":{"isKev":true,"vendorProject":"Fortinet","product":"FortiOS","name":"FortiOS SSL-VPN OOB Write","dateAdded":"2026-07-14","dueDate":"2026-08-04","requiredAction":"Apply mitigations per vendor advisory.","ransomware":"Unknown"},"tier":"P1","reasons":["Listed in CISA KEV (known exploited)","CVSS 8.8 HIGH (v3.1)","EPSS 62.1% probability","EPSS 97.0 percentile","Published recently (25d ago)"],"refs":[{"url":"https://nvd.nist.gov/vuln/detail/CVE-2026-10002","source":"nvd@nist.gov"},{"url":"https://vendor.example/advisory/CVE-2026-10002","source":"vendor"}],"flags":[]},{"id":"CVE-2026-10003","desc":"A path traversal in mod_rewrite lets an unauthenticated attacker read files outside the document root.","published":"2026-07-10T08:30:00Z","modified":"2026-07-18T08:30:00Z","status":"Analyzed","vendors":["Apache"],"vendorsRaw":["apache"],"products":["http_server"],"cwes":["CWE-22"],"cvss":{"version":"4.0","score":9.1,"severity":"CRITICAL","vector":"CVSS:4.0/AV:N/AC:L/AT:N/PR:N/UI:N/VC:H/VI:H/VA:L/SC:N/SI:N/SA:N","source":"nvd@nist.gov"},"epss":{"p":0.6805,"pct":0.981,"date":"2026-07-23"},"kev":null,"tier":"P1","reasons":["CVSS 9.1 CRITICAL (v4.0)","EPSS 68.0% probability","EPSS 98.1 percentile","Published recently (13d ago)"],"refs":[{"url":"https://nvd.nist.gov/vuln/detail/CVE-2026-10003","source":"nvd@nist.gov"},{"url":"https://vendor.example/advisory/CVE-2026-10003","source":"vendor"}],"flags":[]},{"id":"CVE-2026-10004","desc":"Unsafe deserialization in the WebLogic T3 listener can lead to remote code execution.","published":"2026-05-20T10:00:00Z","modified":"2026-07-01T10:00:00Z","status":"Analyzed","vendors":["Oracle"],"vendorsRaw":["oracle"],"products":["weblogic_server"],"cwes":["CWE-502"],"cvss":{"version":"3.1","score":8.2,"severity":"HIGH","vector":"CVSS:3.1/AV:N/AC:H/PR:N/UI:N/S:U/C:H/I:H/A:L","source":"nvd@nist.gov"},"epss":{"p":0.153,"pct":0.921,"date":"2026-07-23"},"kev":null,"tier":"P2","reasons":["CVSS 8.2 HIGH (v3.1)","EPSS 15.3% probability","EPSS 92.1 percentile"],"refs":[{"url":"https://nvd.nist.gov/vuln/detail/CVE-2026-10004","source":"nvd@nist.gov"},{"url":"https://vendor.example/advisory/CVE-2026-10004","source":"vendor"}],"flags":[]},{"id":"CVE-2026-10005","desc":"A type confusion in Acrobat Reader allows code execution when a victim opens a malicious PDF.","published":"2026-07-12T12:00:00Z","modified":"2026-07-14T12:00:00Z","status":"Analyzed","vendors":["Adobe"],"vendorsRaw":["adobe"],"products":["acrobat_reader"],"cwes":["CWE-843"],"cvss":{"version":"3.1","score":9.3,"severity":"CRITICAL","vector":"CVSS:3.1/AV:L/AC:L/PR:N/UI:R/S:C/C:H/I:H/A:H","source":"nvd@nist.gov"},"epss":{"p":0.0402,"pct":0.765,"date":"2026-07-23"},"kev":null,"tier":"P2","reasons":["CVSS 9.3 CRITICAL (v3.1)","EPSS 4.0% probability","EPSS 76.5 percentile","Published recently (11d ago)"],"refs":[{"url":"https://nvd.nist.gov/vuln/detail/CVE-2026-10005","source":"nvd@nist.gov"},{"url":"https://vendor.example/advisory/CVE-2026-10005","source":"vendor"}],"flags":[]},{"id":"CVE-2026-10006","desc":"An out-of-bounds read in the V8 engine can disclose memory contents to a crafted web page.","published":"2026-07-08T09:00:00Z","modified":"2026-07-17T09:00:00Z","status":"Analyzed","vendors":["Google"],"vendorsRaw":["google"],"products":["chrome"],"cwes":["CWE-125"],"cvss":{"version":"3.1","score":6.5,"severity":"MEDIUM","vector":"CVSS:3.1/AV:N/AC:L/PR:N/UI:R/S:U/C:H/I:N/A:N","source":"nvd@nist.gov"},"epss":{"p":0.0088,"pct":0.4123,"date":"2026-07-23"},"kev":null,"tier":"P4","reasons":["Did not meet a higher tier"],"refs":[{"url":"https://nvd.nist.gov/vuln/detail/CVE-2026-10006","source":"nvd@nist.gov"},{"url":"https://vendor.example/advisory/CVE-2026-10006","source":"vendor"}],"flags":[]},{"id":"CVE-2026-10007","desc":"Missing authentication for a vCenter management endpoint exposes inventory data.","published":"2026-04-15T13:00:00Z","modified":"2026-06-30T13:00:00Z","status":"Analyzed","vendors":["VMware"],"vendorsRaw":["vmware"],"products":["vcenter_server"],"cwes":["CWE-306"],"cvss":{"version":"3.1","score":7.5,"severity":"HIGH","vector":"CVSS:3.1/AV:N/AC:L/PR:N/UI:N/S:U/C:H/I:N/A:N","source":"nvd@nist.gov"},"epss":{"p":0.0221,"pct":0.605,"date":"2026-07-23"},"kev":null,"tier":"P3","reasons":["CVSS 7.5 HIGH (v3.1)","EPSS 2.2% probability","EPSS 60.5 percentile"],"refs":[{"url":"https://nvd.nist.gov/vuln/detail/CVE-2026-10007","source":"nvd@nist.gov"},{"url":"https://vendor.example/advisory/CVE-2026-10007","source":"vendor"}],"flags":[]},{"id":"CVE-2026-10008","desc":"A resource-exhaustion flaw in NetScaler ADC allows a denial of service under crafted TLS load.","published":"2026-06-02T15:00:00Z","modified":"2026-07-02T15:00:00Z","status":"Analyzed","vendors":["Citrix"],"vendorsRaw":["citrix"],"products":["netscaler_adc"],"cwes":["CWE-400"],"cvss":{"version":"3.1","score":5.9,"severity":"MEDIUM","vector":"CVSS:3.1/AV:N/AC:H/PR:N/UI:N/S:U/C:N/I:N/A:H","source":"nvd@nist.gov"},"epss":{"p":0.0035,"pct":0.993,"date":"2026-07-23"},"kev":null,"tier":"P2","reasons":["CVSS 5.9 MEDIUM (v3.1)","EPSS 0.4% probability","EPSS 99.3 percentile"],"refs":[{"url":"https://nvd.nist.gov/vuln/detail/CVE-2026-10008","source":"nvd@nist.gov"},{"url":"https://vendor.example/advisory/CVE-2026-10008","source":"vendor"}],"flags":[]},{"id":"CVE-2026-10009","desc":"An information exposure in Connect Secure reveals limited configuration details to an authenticated user.","published":"2026-03-11T07:00:00Z","modified":"2026-05-11T07:00:00Z","status":"Modified","vendors":["Ivanti"],"vendorsRaw":["ivanti"],"products":["connect_secure"],"cwes":["CWE-200"],"cvss":{"version":"3.1","score":4.3,"severity":"MEDIUM","vector":"CVSS:3.1/AV:N/AC:L/PR:L/UI:N/S:U/C:L/I:N/A:N","source":"nvd@nist.gov"},"epss":{"p":0.0011,"pct":0.1502,"date":"2026-07-23"},"kev":null,"tier":"P4","reasons":["Did not meet a higher tier"],"refs":[{"url":"https://nvd.nist.gov/vuln/detail/CVE-2026-10009","source":"nvd@nist.gov"},{"url":"https://vendor.example/advisory/CVE-2026-10009","source":"vendor"}],"flags":[]},{"id":"CVE-2026-10010","desc":"A reported issue in Cisco IOS XE is awaiting analysis; severity metrics are not yet available.","published":"2026-07-01T06:00:00Z","modified":"2026-07-01T06:00:00Z","status":"Awaiting Analysis","vendors":["Cisco"],"vendorsRaw":["cisco"],"products":["ios_xe"],"cwes":[],"cvss":null,"epss":null,"kev":null,"tier":"P4","reasons":["Did not meet a higher tier"],"refs":[{"url":"https://nvd.nist.gov/vuln/detail/CVE-2026-10010","source":"nvd@nist.gov"},{"url":"https://vendor.example/advisory/CVE-2026-10010","source":"vendor"}],"flags":["no_epss","no_cvss"]},{"id":"CVE-2025-9002","desc":"A command injection in the Cisco ASA web interface permits authenticated command execution.","published":"2025-11-04T10:00:00Z","modified":"2026-07-10T10:00:00Z","status":"Analyzed","vendors":["Cisco"],"vendorsRaw":["cisco"],"products":["asa"],"cwes":["CWE-78"],"cvss":{"version":"3.1","score":7.2,"severity":"HIGH","vector":"CVSS:3.1/AV:N/AC:L/PR:L/UI:N/S:U/C:H/I:L/A:N","source":"nvd@nist.gov"},"epss":{"p":0.33,"pct":0.955,"date":"2026-07-23"},"kev":{"isKev":true,"vendorProject":"Cisco","product":"ASA","name":"Cisco ASA Command Injection","dateAdded":"2026-01-20","dueDate":"2026-02-10","requiredAction":"Apply updates; restrict management access.","ransomware":"Known"},"tier":"P1","reasons":["Listed in CISA KEV (known exploited)","Known ransomware campaign use","CVSS 7.2 HIGH (v3.1)","EPSS 33.0% probability","EPSS 95.5 percentile"],"refs":[{"url":"https://nvd.nist.gov/vuln/detail/CVE-2025-9002","source":"nvd@nist.gov"},{"url":"https://vendor.example/advisory/CVE-2025-9002","source":"vendor"}],"flags":[]},{"id":"CVE-2025-9001","desc":"Orion Auth Bypass","published":null,"modified":null,"status":null,"vendors":[],"vendorsRaw":[],"products":[],"cwes":[],"cvss":null,"epss":{"p":0.07,"pct":0.88,"date":"2026-07-23"},"kev":{"isKev":true,"vendorProject":"SolarStack","product":"Orion Platform","name":"Orion Auth Bypass","dateAdded":"2026-02-15","dueDate":"2026-03-08","requiredAction":"Apply hotfix and rotate credentials.","ransomware":"Unknown"},"tier":"P1","reasons":["Listed in CISA KEV (known exploited)","EPSS 7.0% probability","EPSS 88.0 percentile"],"refs":[],"flags":["no_nvd_record","no_cvss"]}]